{
 "schema_version": "1",
 "cache_key": "1a72e60b6f09ab34fd42",
 "repo_id": 1433377156,
 "full_name": "unclebob/ub-mode",
 "created_at": "2026-10-28T06:17:57+08:00",
 "model": "claude-opus-5-5",
 "prompt_version": "c1",
 "input_sha256": "ba08b0f6a5e2563d9426c406b7dc23958558f5a870d92a07c4e97cc4e2a812df",
 "has_readme": true,
 "readme_chars": 1246,
 "content": {
  "one_liner": "讓 AI 寫程式助理照嚴謹軟體工程原則寫碼的技能檔",
  "features": [
   "要求 AI 先求能動、再求正確，遵守 TDD 等原則",
   "搭配品質檢查工具，例如 CRAP 指標與突變測試",
   "可用 UML 檢視器看元件、覆蓋率與相依方向"
  ],
  "audience": "使用 Claude、Cursor、Grok 等 AI 助理寫程式的軟體開發者",
  "use_cases": [
   "請 AI 助理撰寫或修改程式碼時，套用測試驅動開發等紀律",
   "用突變測試找出測試沒抓到的程式碼漏洞",
   "可能用於團隊統一 AI 產出程式碼的品質標準"
  ],
  "barrier": "code",
  "barrier_note": "需把 SKILL.md 放進 AI 助理的技能資料夾，並在寫程式時用 /ub-mode 叫用",
  "limitations": "README 未說明",
  "based_on": [
   "readme"
  ]
 }
}
