{
 "schema_version": "1",
 "cache_key": "682092cf935f41dcde24",
 "repo_id": 1226205410,
 "full_name": "Renhuai123/ziwei-doushu",
 "created_at": "2026-10-29T06:38:52+08:00",
 "model": "claude-opus-5-5",
 "prompt_version": "c1",
 "input_sha256": "c8d37e3f10151bd91719893c414e0289234d9ee75388bb300bf64c5e56de01ed",
 "has_readme": true,
 "readme_chars": 12000,
 "content": {
  "one_liner": "依照倪海厦《天纪》體系排紫微斗數命盤的開源引擎，附解讀資料集",
  "features": [
   "排盤引擎：真太陽時校正、四化飛星、格局判定",
   "開放下載 67.5 萬張命盤的 13 維解讀資料集",
   "收錄古籍原文與倪師《天紀》原話 1848 條"
  ],
  "audience": "想自己做紫微斗數 App 或網站的開發者、命理研究者、要找 AI 訓練資料的人",
  "use_cases": [
   "以開源引擎為基礎，開發自己的紫微斗數排盤產品",
   "把解讀資料集拿來微調 AI 模型或當作 RAG 檢索來源",
   "研究紫微斗數古籍與倪師教學原話"
  ],
  "barrier": "code",
  "barrier_note": "需要用命令列下載並執行 Next.js 專案；資料集解壓縮要用 zstd 工具",
  "limitations": "開源版沒有斷語庫和 AI 解讀，Demo 介面只畫得出命盤；六親分析僅供參考；倪師原話不可商用",
  "based_on": [
   "description",
   "readme",
   "topics"
  ]
 }
}
