{
 "schema_version": "1",
 "cache_key": "e0f185cb2ce6271690c0",
 "repo_id": 1435695423,
 "full_name": "anhao/ai-pose-gallery-zh",
 "created_at": "2026-10-29T06:39:37+08:00",
 "model": "claude-opus-5-5",
 "prompt_version": "c1",
 "input_sha256": "5f2b34d10347d4df36042034a8be2a3c78e034f9e747b377318e6590178b58c1",
 "has_readme": true,
 "readme_chars": 3265,
 "content": {
  "one_liner": "把日文 AI 人體姿勢參考圖庫翻成中文，做成可以瀏覽和下載的網頁畫廊",
  "features": [
   "收錄 1439 筆記錄，含縮圖與原圖共 2878 張",
   "可依分類、5 種視角篩選，也能用關鍵字搜尋",
   "燈箱檢視多角度圖片，可直接下載 PNG 原圖"
  ],
  "audience": "需要人體姿勢參考的 AI 繪圖、3D、攝影創作者，以及想學習架設靜態網站的人",
  "use_cases": [
   "AI 繪圖或畫畫前，找不同角度的人體姿勢當參考",
   "3D 建模或攝影時，參考站姿、坐姿等動作分類",
   "把整套畫廊部署到 Cloudflare Pages 架成自己的網站"
  ],
  "barrier": "online",
  "barrier_note": "有線上展示網頁可以直接瀏覽；要自己架站或在本機預覽，就得用命令列與 Cloudflare 帳號",
  "limitations": "含成人向內容，未成年人請勿瀏覽；圖片著作權屬原作者ギア，MIT 授權不涵蓋圖片與資料",
  "based_on": [
   "description",
   "readme",
   "topics"
  ]
 }
}
