{
 "schema_version": "1",
 "cache_key": "cbdddadedc676106bed1",
 "repo_id": 1438394948,
 "full_name": "valentderah/totk-pc-recomp",
 "created_at": "2026-10-30T06:49:31+08:00",
 "model": "claude-opus-5-5",
 "prompt_version": "c1",
 "input_sha256": "bf19d9024b9e89b1e0f0089eb97336b797a854125bb7dc91e4f136d15efd7035",
 "has_readme": true,
 "readme_chars": 3260,
 "content": {
  "one_liner": "把 Switch 遊戲《薩爾達傳說 王國之淚》轉成能在 Windows 直接執行的版本",
  "features": [
   "原生程式碼執行，不是模擬器，使用 Vulkan 繪圖",
   "支援自訂解析度、AMD FSR 1，預設 60 fps",
   "支援鍵盤、滑鼠、手把，可重新設定按鍵與體感"
  ],
  "audience": "擁有 Switch 主機與正版《王國之淚》、想在 Windows 電腦上遊玩的玩家",
  "use_cases": [
   "用自己主機備份的遊戲檔，在 Windows 電腦上玩《王國之淚》",
   "以更高解析度或更高畫面更新率（實驗性）遊玩",
   "在 1.2.1 與 1.4.3 版本之間沿用存檔"
  ],
  "barrier": "install",
  "barrier_note": "需 Windows 10 以上、支援 AVX2 的 CPU 與 Vulkan 1.3 顯示卡，並自備從主機取出的遊戲檔",
  "limitations": "尚在早期開發，仍會有畫面錯誤與當機；不含遊戲檔，作者不提供取得方式；安裝時需約 36 GiB 空間",
  "based_on": [
   "description",
   "readme"
  ]
 }
}
