{
 "schema_version": "1",
 "cache_key": "64d4eb573c26efe0f231",
 "repo_id": 1226971975,
 "full_name": "beenuar/AiSOC",
 "created_at": "2026-10-30T06:48:59+08:00",
 "model": "claude-opus-5-5",
 "prompt_version": "c1",
 "input_sha256": "881e4bfccab66ed9721157a13f56c66646b5df705e60a4a0b56b6380fe80137f",
 "has_readme": true,
 "readme_chars": 12000,
 "content": {
  "one_liner": "開源、可自架的 AI 資安監控中心，自動彙整警報並由 AI 協助研判",
  "features": [
   "彙整多種資安工具的警報並以規則偵測威脅",
   "AI agent 研判警報，每步推理都記錄可稽核",
   "內建本機模型與 MCP server，不需 API 金鑰"
  ],
  "audience": "企業資安團隊、SOC 分析師、藍隊與偵測工程人員",
  "use_cases": [
   "串接 Splunk、CrowdStrike、AWS 等來源，集中處理資安警報",
   "讓 AI 初步研判警報，再由人員核准後續回應動作",
   "把既有 Splunk SPL 等偵測規則轉換後沿用"
  ],
  "barrier": "code",
  "barrier_note": "需用命令列操作 Docker Compose，電腦至少要有 8 GB 記憶體、20 GB 硬碟空間",
  "limitations": "內建的是小型本機模型，作者表示不是頂尖模型；從未測試過雲端模型服務；第一次執行要下載約 2 GB",
  "based_on": [
   "description",
   "readme",
   "topics"
  ]
 }
}
