{
 "schema_version": "1",
 "cache_key": "f2d4fbf1ac2f5f0a8cef",
 "repo_id": 1331261687,
 "full_name": "milind-soni/OpenMausBot",
 "created_at": "2026-10-30T06:48:36+08:00",
 "model": "claude-opus-5-5",
 "prompt_version": "c1",
 "input_sha256": "e646c19e538d65eafb5bc4f08b377ac2c305f4718057ea9e1169889ff9bc3718",
 "has_readme": true,
 "readme_chars": 12000,
 "content": {
  "one_liner": "在聊天 App 裡組一支 AI 機器人團隊，每個機器人都有自己的模型和電腦",
  "features": [
   "每個機器人可各自選用 Claude、Codex 或 Grok 模型",
   "機器人可操作雲端桌面、本機 VM 或你的電腦",
   "高風險動作先跳出卡片，由使用者允許或拒絕"
  ],
  "audience": "已有 Claude、ChatGPT 或 Grok 訂閱，想讓多個 AI 代理幫忙處理工作的進階使用者",
  "use_cases": [
   "串接 Gmail、Slack、Notion 等 App，讓機器人代為處理工作",
   "把工作、個人、各專案分在不同頻道，各自管理機器人",
   "用語音通話聽機器人回報進度並口頭核准動作"
  ],
  "barrier": "code",
  "barrier_note": "有 macOS、Windows、Ubuntu 安裝檔，但需先在電腦安裝並登入 claude、codex 等命令列工具",
  "limitations": "Ubuntu Wayland 暫不支援控制本機；本機控制需手動開啟；與任何加密貨幣無關，也非 xAI 等公司官方產品",
  "based_on": [
   "description",
   "readme",
   "topics"
  ]
 }
}
