{
 "schema_version": "1",
 "cache_key": "46bbf3f1f80896043987",
 "repo_id": 523325759,
 "full_name": "hmjz100/LinkSwift",
 "created_at": "2026-10-29T06:38:46+08:00",
 "model": "claude-opus-5-5",
 "prompt_version": "c1",
 "input_sha256": "a288d115a0f725f6712f35e5b420952497a9746b639721695fa0b03c137ed411",
 "has_readme": true,
 "readme_chars": 1132,
 "content": {
  "one_liner": "在瀏覽器裡取得百度網盤、阿里雲盤等多家網盤檔案直接下載連結的使用者腳本",
  "features": [
   "支援百度、阿里、夸克、123 雲盤等九家網盤",
   "取得檔案直鏈並美化網盤介面",
   "可搭配 Aria2、Motrix 等多種下載器"
  ],
  "audience": "常用中國網盤下載檔案，但不方便或不想安裝官方客戶端的使用者",
  "use_cases": [
   "不安裝百度網盤客戶端，直接在網頁取得下載連結",
   "把網盤檔案連結交給 Aria2 或 Motrix 等下載器下載",
   "在夸克、天翼等多個網盤間用同一套工具下載檔案"
  ],
  "barrier": "install",
  "barrier_note": "需先在瀏覽器安裝 Tampermonkey 等腳本管理擴充功能，再安裝此腳本",
  "limitations": "作者表示連結取自網盤公開 API，不保證也不提供破解限速；金絲雀版可能不穩定，部分來源更新較慢",
  "based_on": [
   "description",
   "readme",
   "topics"
  ]
 }
}
