{
 "schema_version": "1",
 "cache_key": "d74eb8aa41dcc52e1b58",
 "repo_id": 1136590548,
 "full_name": "affaan-m/ECC",
 "created_at": "2026-10-31T06:25:05+08:00",
 "model": "claude-opus-5-5",
 "prompt_version": "c1",
 "input_sha256": "08586d75c0800f762d5b5ad30a02c4dd37081e2bfa19e80e311fd97fb6d44992",
 "has_readme": true,
 "readme_chars": 12000,
 "content": {
  "one_liner": "替 Claude Code 等 AI 寫程式助手加上一整套規劃、測試、記憶與安全檢查的工作流程",
  "features": [
   "內含 71 個 agents、314 個 skills 與指令",
   "記憶、持續學習與 hooks 規範 agent 行為",
   "AgentShield 掃描提示詞、MCP 設定與機密"
  ],
  "audience": "使用 Claude Code、Codex、Cursor 等 AI 寫程式工具的軟體開發者",
  "use_cases": [
   "讓 AI agent 先規劃再寫程式，並用測試驗證修改",
   "用 AgentShield 檢查 agent 設定檔、權限與機密外洩風險",
   "在 Claude Code、Codex、Kimi Code 一次設定同一套工作流程"
  ],
  "barrier": "code",
  "barrier_note": "需安裝 Node.js 18 以上、Git 與 Claude Code 2.1 以上，並用命令列執行安裝",
  "limitations": "只從官方管道安裝，避免惡意版本；同一工具不要重複安裝；Cursor 等工具僅有功能受限的支援；私有 repo 的 Pro 版要付費",
  "based_on": [
   "description",
   "readme",
   "topics"
  ]
 }
}
