{
 "schema_version": "1",
 "cache_key": "e53c6b3b2fb3ee04584f",
 "repo_id": 1433904617,
 "full_name": "andyhuo520/digital-human-koubo",
 "created_at": "2026-10-28T06:18:07+08:00",
 "model": "claude-opus-5-5",
 "prompt_version": "c1",
 "input_sha256": "8e1e2c288b9bac4ee417d52bde98a62f365414d7185bc1e83e86ad26bfc662e6",
 "has_readme": true,
 "readme_chars": 12000,
 "content": {
  "one_liner": "用一張照片加一句話，讓 AI 助理自動做出 AI 數位人口播影片",
  "features": [
   "一張照片建立固定的數位人主播並對嘴說話",
   "5 種剪輯風格與 48 種包裝元件",
   "自動校對字幕、統一聲音，生成前先報價"
  ],
  "audience": "想用 AI 主播製作帶貨、教學、解說影片的創作者與小商家，需熟悉 AI 助理工具",
  "use_cases": [
   "製作 9:16 直播帶貨廣告，附價格動畫與字幕",
   "做產品推薦或步驟教學的口播影片",
   "用多國語言、多位主播製作展示影片"
  ],
  "barrier": "code",
  "barrier_note": "需 Claude Code 等 AI 助理、Renoise 帳號，並用命令列安裝 ffmpeg 等工具",
  "limitations": "生成需消耗 Renoise 點數；「文字在主播後方」效果僅支援 macOS；換聲音會有約 100 ms 對嘴落差；只能用自己或已獲授權的照片與聲音",
  "based_on": [
   "description",
   "readme"
  ]
 }
}
