{
 "schema_version": "1",
 "cache_key": "6b376f5634316ac2fdf9",
 "repo_id": 1273646780,
 "full_name": "togg53192-cmd/jailbreaks",
 "created_at": "2026-10-28T06:17:17+08:00",
 "model": "claude-opus-5-5",
 "prompt_version": "c1",
 "input_sha256": "83552dee51e9aa4744174005cd233b7e92e935ba658723e8bf5baa089e6e4025",
 "has_readme": true,
 "readme_chars": 7179,
 "content": {
  "one_liner": "收集各家 AI 模型「越獄」提示詞的清單，試圖讓模型繞過原本的行為規範",
  "features": [
   "31 份提示詞，涵蓋 Claude、Gemini 等 25 個以上模型",
   "包含系統提示詞、AGENTS.md 與 Ollama Modelfile",
   "作者表示每個檔案都是完整、可直接貼上的版本"
  ],
  "audience": "研究 AI 安全、提示詞注入（prompt injection）防護的研究人員與開發者",
  "use_cases": [
   "研究人員觀察角色設定與指令衝突如何影響模型行為",
   "開發者可能用來測試自家 AI 系統抵抗提示詞注入的能力"
  ],
  "barrier": "code",
  "barrier_note": "需要懂 API 系統提示詞、AGENTS.md 或 Ollama 等開發工具的設定方式",
  "limitations": "僅限研究與教育用途；使用可能違反模型服務條款。作者表示效果依模型版本而定，更新後可能失效",
  "based_on": [
   "description",
   "readme"
  ]
 }
}
